{
  "entries": [
    {
      "approval_requirement": "Lifecycle transitions and directive closure require separate explicit user decisions.",
      "authorization_ref": "DIR-20260727-004",
      "example_refs": [
        ".agents/skills/pfmval-governance/templates/document_lifecycle_review_intake.json"
      ],
      "implementation_locations": [
        ".agents/skills/pfmval-governance/SKILL.md",
        "scripts/pfmval_knowledge.py",
        "deploy/pfmval_ops.py"
      ],
      "inputs": [
        "document lifecycle review intake"
      ],
      "last_verified_at": "2026-07-26T20:26:56.590353+00:00",
      "lifecycle": "active",
      "outputs": [
        "freshness preview",
        "impact preview"
      ],
      "purpose": "Preview document and constraint freshness, dependency impact, and review_due status without automatic lifecycle changes.",
      "real_operation_status": "NOT RUN",
      "registration_digest": "6c58d16959ed7c1e0e030332365113faea9f65c9c17535b4c1b15ae9927fd890",
      "registration_manifest": "project_state/workflow_manifests/g08_approved_workflows.json",
      "registration_manifest_sha256": "9e67360979c2594902f17ab732999b810950e3d124c0b146cfac727a97f90fa0",
      "replacement_workflow_ids": [],
      "risk": "medium",
      "schema_refs": [],
      "scientific_evidence_tier": "N/A",
      "stable_version": false,
      "standardized": false,
      "supersedes": [],
      "technical_routes": [
        "lifecycle_review"
      ],
      "test_refs": [
        "tests/test_pfmval_governance_skill.py",
        "tests/test_pfmval_knowledge_documents.py"
      ],
      "trigger": "The user asks whether a governed document or constraint needs review.",
      "user_entry": "document_lifecycle",
      "version": "0.1.0",
      "workflow_id": "WF-DOCUMENT-LIFECYCLE"
    },
    {
      "approval_requirement": "Content rewrite and cloud backup require later explicit approval.",
      "authorization_ref": "DIR-20260727-004",
      "example_refs": [
        ".agents/skills/pfmval-governance/templates/learning_guide_intake.json"
      ],
      "implementation_locations": [
        ".agents/skills/pfmval-governance/SKILL.md",
        "scripts/pfmval_knowledge.py",
        "deploy/pfmval_ops.py"
      ],
      "inputs": [
        "learning guide intake"
      ],
      "last_verified_at": "2026-07-26T20:26:56.301244+00:00",
      "lifecycle": "active",
      "outputs": [
        "interface_reserved"
      ],
      "purpose": "Reserve a versioned source and experiment linkage interface for learning guides without rewriting existing guide content.",
      "real_operation_status": "NOT RUN",
      "registration_digest": "99160a53d65cccd57cec99cd5200bb407abd8103b482938b6a951857d7d6aedd",
      "registration_manifest": "project_state/workflow_manifests/g08_approved_workflows.json",
      "registration_manifest_sha256": "9e67360979c2594902f17ab732999b810950e3d124c0b146cfac727a97f90fa0",
      "replacement_workflow_ids": [],
      "risk": "low",
      "schema_refs": [],
      "scientific_evidence_tier": "N/A",
      "stable_version": false,
      "standardized": false,
      "supersedes": [],
      "technical_routes": [
        "learning_guide"
      ],
      "test_refs": [
        "tests/test_pfmval_governance_skill.py",
        "tests/test_pfmval_knowledge_documents.py"
      ],
      "trigger": "The user asks to create or maintain a learning guide.",
      "user_entry": "learning_guide",
      "version": "0.1.0",
      "workflow_id": "WF-LEARNING-GUIDE"
    },
    {
      "approval_requirement": "Real content and source references must be supplied by the user or current repositories.",
      "authorization_ref": "DIR-20260727-004",
      "example_refs": [
        ".agents/skills/pfmval-governance/templates/meeting_brief_intake.json",
        ".agents/skills/pfmval-governance/templates/research_path_intake.json"
      ],
      "implementation_locations": [
        ".agents/skills/pfmval-governance/SKILL.md",
        "scripts/pfmval_knowledge.py",
        "deploy/pfmval_ops.py"
      ],
      "inputs": [
        "meeting brief intake",
        "research path intake"
      ],
      "last_verified_at": "2026-07-26T20:26:56.031641+00:00",
      "lifecycle": "active",
      "outputs": [
        "meeting_brief draft",
        "research_path draft"
      ],
      "purpose": "Create a brief meeting summary or a longer research path while preserving evidence classes, negative results, stop rules, and uncertainty.",
      "real_operation_status": "NOT RUN",
      "registration_digest": "ea6e33319c256972118cd98e5f2284c57a084acf12761b7b2537e251ce220ab4",
      "registration_manifest": "project_state/workflow_manifests/g08_approved_workflows.json",
      "registration_manifest_sha256": "9e67360979c2594902f17ab732999b810950e3d124c0b146cfac727a97f90fa0",
      "replacement_workflow_ids": [],
      "risk": "low",
      "schema_refs": [],
      "scientific_evidence_tier": "N/A",
      "stable_version": false,
      "standardized": false,
      "supersedes": [],
      "technical_routes": [
        "meeting_brief",
        "research_path"
      ],
      "test_refs": [
        "tests/test_pfmval_governance_skill.py",
        "tests/test_pfmval_knowledge_documents.py"
      ],
      "trigger": "The user asks to preserve meeting or long-term research context.",
      "user_entry": "longterm_docs",
      "version": "0.1.0",
      "workflow_id": "WF-LONGTERM-DOCS"
    },
    {
      "approval_requirement": "A real senior-author template and writing authorization are required before drafting.",
      "authorization_ref": "DIR-20260727-004",
      "example_refs": [
        ".agents/skills/pfmval-governance/templates/paper_output_intake.json"
      ],
      "implementation_locations": [
        ".agents/skills/pfmval-governance/SKILL.md",
        "scripts/pfmval_knowledge.py",
        "deploy/pfmval_ops.py"
      ],
      "inputs": [
        "paper output intake"
      ],
      "last_verified_at": "2026-07-26T20:26:57.208746+00:00",
      "lifecycle": "active",
      "outputs": [
        "template_pending material index"
      ],
      "purpose": "Index project-local materials and claim references for a future senior-author template without drafting manuscript text.",
      "real_operation_status": "NOT RUN",
      "registration_digest": "bc51f0d230f2769e0f13e0372ce38debe5d3407fa17c085f66835adaccd114b0",
      "registration_manifest": "project_state/workflow_manifests/g08_approved_workflows.json",
      "registration_manifest_sha256": "9e67360979c2594902f17ab732999b810950e3d124c0b146cfac727a97f90fa0",
      "replacement_workflow_ids": [],
      "risk": "low",
      "schema_refs": [],
      "scientific_evidence_tier": "N/A",
      "stable_version": false,
      "standardized": false,
      "supersedes": [],
      "technical_routes": [
        "paper_output"
      ],
      "test_refs": [
        "tests/test_pfmval_governance_skill.py",
        "tests/test_pfmval_knowledge_documents.py"
      ],
      "trigger": "The user asks to prepare project materials for later paper writing.",
      "user_entry": "paper_output",
      "version": "0.1.0",
      "workflow_id": "WF-PAPER-OUTPUT"
    },
    {
      "approval_requirement": "Each real fact requires a separate explicit user confirmation.",
      "authorization_ref": "DIR-20260727-004",
      "example_refs": [
        ".agents/skills/pfmval-governance/templates/project_fact_intake.json"
      ],
      "implementation_locations": [
        ".agents/skills/pfmval-governance/SKILL.md",
        "scripts/pfmval_knowledge.py",
        "deploy/pfmval_ops.py"
      ],
      "inputs": [
        "project fact intake"
      ],
      "last_verified_at": "2026-07-26T20:26:55.766294+00:00",
      "lifecycle": "active",
      "outputs": [
        "confirmation preview",
        "conflict preview"
      ],
      "purpose": "Maintain non-experimental project facts through preview, conflict review, and per-fact confirmation.",
      "real_operation_status": "NOT RUN",
      "registration_digest": "d6f517bf1e112c642b6be55569ba81d07aa56ab2b4460cc9f9ce1c38e509351c",
      "registration_manifest": "project_state/workflow_manifests/g08_approved_workflows.json",
      "registration_manifest_sha256": "9e67360979c2594902f17ab732999b810950e3d124c0b146cfac727a97f90fa0",
      "replacement_workflow_ids": [],
      "risk": "medium",
      "schema_refs": [],
      "scientific_evidence_tier": "N/A",
      "stable_version": false,
      "standardized": false,
      "supersedes": [],
      "technical_routes": [
        "project_fact"
      ],
      "test_refs": [
        "tests/test_pfmval_governance_skill.py",
        "tests/test_pfmval_knowledge_documents.py"
      ],
      "trigger": "The user asks to add, correct, or inspect a non-experimental project fact.",
      "user_entry": "project_fact",
      "version": "0.1.0",
      "workflow_id": "WF-PROJECT-FACT"
    },
    {
      "approval_requirement": "Future candidates require separate review and activation.",
      "authorization_ref": "DIR-20260727-004",
      "example_refs": [
        ".agents/skills/pfmval-governance/templates/workflow_discovery_scope.json"
      ],
      "implementation_locations": [
        ".agents/skills/pfmval-governance/SKILL.md",
        "scripts/pfmval_workflows.py",
        "deploy/pfmval_ops.py"
      ],
      "inputs": [
        "workflow discovery scope manifest"
      ],
      "last_verified_at": "2026-07-26T20:26:56.906993+00:00",
      "lifecycle": "active",
      "outputs": [
        "discovery preview",
        "candidate entries"
      ],
      "purpose": "Discover repeated workflow descriptors only in an explicit tracked scope and keep new discoveries at candidate.",
      "real_operation_status": "NOT RUN",
      "registration_digest": "46ebf93abdd8defaba570778dcb6896213e05f82b76ccb4c04148d8f928b383c",
      "registration_manifest": "project_state/workflow_manifests/g08_approved_workflows.json",